{"schema_version":"1.0","event_id":"evt_000004","project_id":"prj_pelle_pv20_001","sequence":4,"created_at":"2026-05-22T00:03:00Z","actor":{"type":"user","id":"local_user"},"event_type":"measurement_recorded","status":"accepted","payload":{"measurement_id":"M001","mode":"continuity","from":"Q2.1","to":"R17.1","reading":{"kind":"numeric","value":0.3,"unit":"ohm"},"power_state":"off"}}

