{"schema_version":"1.0","event_id":"evt_000005","project_id":"prj_pelle_pv20_001","sequence":5,"created_at":"2026-05-22T00:04:00Z","actor":{"type":"user","id":"local_user"},"event_type":"repair_action_recorded","status":"accepted","payload":{"repair_action_id":"RA001","action_type":"replace_component","targets":["Q2"],"reason":"suspected_fault","after":{"marking":"K72","origin":"donor_board"}}}
