{"schema_version":"1.0","event_id":"evt_000003","project_id":"prj_pelle_pv20_001","sequence":3,"created_at":"2026-05-22T00:02:00Z","actor":{"type":"user","id":"local_user"},"event_type":"component_created","status":"accepted","payload":{"component_id":"Q2","designator":"Q2","type":"unknown_semiconductor","package":"SOT-23","pin_count":3,"marking":"K72"}}
